{
  "schema_version": "1.0",
  "intent_id": "11111111-1111-4111-8111-111111111111",
  "decision_id": "22222222-2222-4222-8222-222222222222",
  "risk_decision_id": "33333333-3333-4333-8333-333333333333",
  "account_id": "acct-1",
  "instrument_id": "BTCUSDT-PERP.BINANCE",
  "action": "open_position",
  "order_plan": {
    "entry": "legacy-open-object"
  },
  "risk_budget": {
    "risk_fraction": 0.01,
    "max_notional": 10000,
    "max_leverage": 3
  },
  "target_position_id": null,
  "valid_until": "2026-06-21T12:00:00Z",
  "idempotency_key": "aaaaaaaaaaaaaaaaaaaaaaaaaaaaaaaaaaaaaaaaaaaaaaaaaaaaaaaaaaaaaaaa",
  "approved_at": "2026-06-21T11:00:00Z"
}
