{
  "schema_version": "1.0",
  "intent_id": "99999999-9999-4999-8999-999999999993",
  "decision_id": "11111111-1111-4111-8111-111111111113",
  "risk_decision_id": "aaaaaaaa-aaaa-4aaa-8aaa-aaaaaaaaaaa3",
  "account_id": "acct-main",
  "instrument_id": "ETHUSDT-PERP.BINANCE",
  "action": "open_position",
  "order_plan": {
    "type": "entry_batch",
    "side": "sell",
    "batch_version": "1",
    "estimated_stop_risk": "20",
    "stop_loss": 3167,
    "tranches": [
      {
        "tranche_id": "e1",
        "seq": 1,
        "type": "limit",
        "price": 2877,
        "sizing_price": "2877",
        "quantity": "0.034"
      },
      {
        "tranche_id": "e2",
        "seq": 2,
        "type": "limit",
        "price": 2967,
        "sizing_price": "2967",
        "quantity": "0.033"
      },
      {
        "tranche_id": "e3",
        "seq": 3,
        "type": "limit",
        "price": 3067,
        "sizing_price": "3067",
        "quantity": "0.032"
      }
    ]
  },
  "risk_budget": {
    "risk_fraction": 0.01,
    "max_notional": 300,
    "max_leverage": 3
  },
  "target_position_id": null,
  "valid_until": "2026-09-22T12:00:00Z",
  "idempotency_key": "bbbbbbbbbbbbbbbbbbbbbbbbbbbbbbbbbbbbbbbbbbbbbbbbbbbbbbbbbbbbbbbb",
  "approved_at": "2026-09-22T11:12:00Z"
}
